query,per_um,ava_um,per_dois,ava_dois,per_tres,ava_tres
o covid-19 acabara com o mundo,"assumindo que covid-19 nao acabou, isso acabara com o mundo e a humanidade?",100,o covid-19 algum dia acabara?,0,que licoes o mundo aprendera com covid-19?,0
o que e covid 19 malaysia,covid 19 malaysia puchong,100,covid 19 malaysia berita,100,covid 19 malaysia moh,100
onde esta o coronavirus reino unido,onde esta o coronavirus agora no reino unido,100,"coronavirus no reino unido, onde",100,casos de coronavirus no reino unido onde,100
como as familias podem se preparar para o bloqueio,como e a vida em bloqueio devido a covid-19,70,quais sao as sugestoes de coisas a fazer na quarentena covid-19,80,quanto tempo esse bloqueio de coronavirus durara,55
quantos casos de coronavirus na fl,quantos casos de coronavirus em orlando fl,100,quantos casos de coronavirus em jacksonville fl,100,quantos casos de coronavirus em napoles fl,100
coronavirus e de,coronavirus e de onde,100,e epidemia de coronavirus,0,e coronavirus de animais,0
o coronavirus sempre inclui febre,o coronavirus sempre apresenta febre,100,o coronavirus sempre comeca com febre,80,o coronavirus sempre mata,0
coronavirus na europa finlandia,coronavirus na europa 2020,40,e coronavirus na europa,40,coronavirus na europa mapa,50
como posso impulsionar o sistema imunologico do meu filho naturalmente,como posso impulsionar meu sistema imunologico naturalmente,50,como posso impulsionar o sistema imunologico do meu cao naturalmente,0,como posso impulsionar o sistema imunologico do meu bebe naturalmente,100
coronavirus e carolina do sul,e o coronavirus da carolina do sul,100,e coronavirus na carolina do norte,0,coreia do sul coreia do sul,0
casos de coronavirus na fl,casos confirmados de coronavirus em fl,100,quantos casos de coronavirus em orlando fl,0,quantos casos de coronavirus em napoles fl,0
quantas mortes por coronavirus no estado de washington,coronavirus no estado de washington,20,quantas mortes por coronavirus no mundo,0,quantas mortes por coronavirus no tennessee,0
virus corona you tube china,virus corona na china you tube,100,you tube corona virus na china,100,coronavirus you tube china,100
vitaminas para fortalecer o sistema imunologico fraco,quais vitaminas tomar para fortalecer seu sistema imunologico,100,quais vitaminas devo tomar para o sistema imunologico fraco,100,como fortalecer o sistema imunologico fraco,20
coronavirus e uma conspiracao falsa,a teoria da conspiracao da china espalhando covid-19 e legitima?,50,quais sao as teorias da conspiracao em torno de covid-19?,50,coronavirus e uma arma,0
o que e um teste de coronavirus,o que e teste de coronavirus,100,existe um teste de coronavirus,0,o que e kit de teste de coronavirus,100
se eu tiver um sistema imunologico enfraquecido devo cancelar meus planos de viagem,devo cancelar a minha viagem?,80,devo cancelar a minha viagem para o exterior?,80,o que fazer se voce tiver um sistema imunologico enfraquecido,0
coisas boas para impulsionar seu sistema imunologico,quais vitaminas sao boas para impulsionar o sistema imunologico,80,coisas para manter seu sistema imunologico forte,100,coisas para impulsionar o sistema imunologico durante a gravidez,100
posso sair,posso ser rastreado ao sair ou chegar ao meu destino?,0,devo sair de casa?,100,e seguro sair de ferias?,100
alimentos para estimular o sistema imunologico quando estiver doente,o que comer para estimular seu sistema imunologico quando estiver doente,100,como posso estimular meu sistema imunologico quando estiver doente,40,como estimular naturalmente seu sistema imunologico quando estiver doente,40
como impulsionar seu sistema imunologico para vencer o hpv,como impulsionar seu sistema imunologico para combater o hpv,100,como impulsionar o seu sistema imunologico para curar o hpv,100,como impulsionar o seu sistema imunologico para limpar o hpv,100
coronavirus originado da sopa de morcegos,o coronavirus veio da sopa de morcego,100,coronavirus originado de,0,coronavirus originado,100
como verificar se ha baixo sistema imunologico,como verificar o sistema imunologico baixo,100,como verificar se o seu sistema imunologico esta baixo,100,como verificar se voce tem um sistema imunologico baixo,100
os sintomas de covid-19 vem e vao,quais sintomas de covid-19 vem primeiro?,0,de onde vem os coronavirus,0,os sintomas de covid-19 vem juntos ou voce pode ter sintomas separados aparecendo em momentos diferentes?,80
qual e o novo nome do coronavirus,qual e o nome do coronavirus?,100,qual e o nome do virus corona,100,qual e o outro nome do virus corona,100
como impulsionar seu sistema imunologico e se manter saudavel na temporada de gripe,como manter seu sistema imunologico forte durante a temporada de gripe,100,como manter seu sistema imunologico saudavel,100,como manter seu sistema imunologico forte e saudavel,100
casos de coronavirus na inglaterra,e coronavirus na inglaterra,100,onde estao os 2 casos de coronavirus na inglaterra,30,coronavirus nhs inglaterra,30
norovirus espalhado pela saliva,norovirus espalhado pela comida,0,voce pode passar norovirus pela saliva,0,o norovirus se espalha pela saliva,100
por que o diabetes e um fator de risco para covid-19,a obesidade e o principal fator de risco nas hospitalizacoes de covid-19?,100,quanto de um fator sera o covid-19 na eleicao presidencial de 2020?,0,o coronavirus afeta o diabetes,50
atualizacao do virus corona china hoje,atualizacao do virus corona da china hoje,100,atualizacao do virus corona na china hoje,100,virus corona na china atualizacao de hoje,100
quanto tempo pode o coronavirus viver sem um hospedeiro,quanto tempo o coronavirus pode sobreviver sem um hospedeiro,100,quanto tempo pode o coronavirus sobreviver sem um hospedeiro,100,quanto tempo o coronavirus dura sem um hospedeiro,100
onde o coronavirus originou o animal,de onde o coronavirus se originou animal,100,onde o coronavirus se originou,0,de qual animal o coronavirus se originou,100
coronavirus filipinas untv,ultimas noticias do virus corona nas filipinas,90,virus corona nas noticias das filipinas,90,virus corona nas noticias filipinas,90
efeito do coronavirus quem,quem covid-19 sintomas,100,quais sao os sintomas da covid-19,90,quais os principais sintomas da covid-19,90
quais requisitos o estabelecimento deve ter para realizar exame rt-pcr,- quais requisitos o estabelecimento deve ter para realizar teste rapido?,0,- para quem o exame rt-pcr e recomendado?,35,- qual estabelecimento pode realizar teste rapido?,0
coronavirus em animais,coronavirus em animais de estimacao,100,coronavirus em sintomas de animais,0,o coronavirus comecou em animais,0
impacto do coronavirus na poluicao da china,impacto do coronavirus na fabricacao da china,0,impacto do coronavirus na economia da china,0,impacto do coronavirus na china,70
virus corona em orange county ca,coronavirus em orange county ca,100,coronavirus orange county ca,100,mapa do coronavirus orange county ca,0
como melhorar seu sistema imunologico durante a gravidez,como fortalecer seu sistema imunologico durante a gravidez,100,como construir seu sistema imunologico durante a gravidez,100,como impulsionar seu sistema imunologico durante a gravidez,100
sinais de que meu sistema imunologico esta fraco,sinais de que seu sistema imunologico esta ficando fraco,100,sinais de que voce tem sistema imunologico fraco,100,sinais de que seu sistema imunologico esta forte,0
como saber se seu sistema imunologico esta fraco ou forte,como saber se seu sistema imunologico esta fraco,80,como saber se o seu sistema imunologico esta fraco,70,como saber se o seu sistema imunologico esta forte,70
o que fazer se eu estiver doente,"se eu estiver infectado, serei internado?",70,o que fazer se o sistema imunologico estiver fraco,70,o que fazer se o sistema imunologico estiver baixo,0
fonte de coronavirus wuhan,fonte de coronavirus,0,fonte de animais coronavirus,0,animal fonte de coronavirus,70
coronavirus em navio de cruzeiro no japao,coronavirus em cruzeiro no japao,80,mais tres casos de virus corona encontrados em navio de cruzeiro no japao,70,coronavirus em navio de japao,80
o covid-19 e muito menos ameacador do que ser retratado na midia,"por que estamos perdendo para covid-19, apesar de ser um pais muito rico?",0,coronavirus e muito serio,50,o medo em torno do covid-19 e justificado ou e muito cedo para dizer?,80
o coronavirus se espalha pelo ovo,o coronavirus se espalha pelo papel,0,o coronavirus se espalha pelo ar,0,o coronavirus se espalha pelo frango,70
coronavirus na california irvine,coronavirus orange county irvine,60,coronavirus infectado na california,30,coronavirus na california 8400,40
os casos de covid-19 estao caindo,por que os mercados de acoes estao caindo em resposta ao covid-19?,0,os casos de covid-19 estao diminuindo?,80,os casos covid-19 estao diminuindo?,100
como o coronavirus comeca,como o sintoma covid-19 comeca?,100,como comeca a tosse do coronavirus,20,como o virus corona comeca na china,0
e covid 19 na nigeria,noticias sobre o virus corona na nigeria,90,atualizacao do virus corona na nigeria,90,atualizacao de coronavirus na nigeria,90
como voce sabe que seu sistema imunologico e forte,como voce sabe se o seu sistema imunologico e forte,100,como voce sabe se seu sistema imunologico esta forte,100,como voce sabe quando seu sistema imunologico esta forte,100
como pode melhorar o sistema imunologico,como voce pode melhorar seu sistema imunologico,100,voce pode melhorar o sistema imunologico,100,como melhorar o sistema imunologico,100
existe uma diferenca entre covid-19 ser uma epidemia e uma pandemia,existe uma conexao entre covid-19 e temperatura ambiente?,0,covid-19 e uma pandemia?,50,o coronavirus e uma epidemia ou pandemia,100
coronavirus no paquistao 2020,e coronavirus no paquistao,100,pacientes coronavirus no paquistao,80,atualizacao do coronavirus no paquistao,80
sintomas do virus corona na africa do sul,sobre o virus corona na africa do sul,40,virus corona e africa do sul,50,e o virus corona na africa do sul,45
coronavirus italia rugbi da inglaterra,coronavirus nhs inglaterra,0,"coronavirus em londres, inglaterra",0,noticias sobre coronavirus inglaterra,30
coronavirus na florida hoje,coronavirus na florida sarasota,40,coronavirus na florida miami,40,e coronavirus na florida,75
que medidas minha familia pode tomar para reduzir nosso risco de contrair covid-19,o que posso fazer para preparar minha familia para um surto de covid-19?,90,coronavirus posso ver minha familia,0,coronavirus posso visitar minha familia,0
como construir o sistema imunologico em criancas,como construir o sistema imunologico das criancas,100,como construir o sistema imunologico para criancas,100,alimentos para construir o sistema imunologico em criancas,100
casos de coronavirus na america,quantos casos de coronavirus existem na america,100,quantos casos do coronavirus na america,100,quantos casos do coronavirus existem na america,100
covid-19 e pior do que a gripe,por que covid-19 e pior do que a gripe?,100,covid-19 e pior que gripe?,100,covid-19 e pior que a gripe espanhola?,50
pacientes com coronavirus na india ultimas noticias,quantos pacientes com coronavirus na india,40,coronavirus infectado na india ultimas noticias,100,ultimas noticias sobre coronavirus na india,90
ha risco de contaminacao pelo novo coronavirus quando em contato com embalagens ou produtos enviados do exterior,qual e o risco de contaminacao pelo novo coronavirus em um aviao?,0,estou em risco de covid-19 de pacotes de correio ou produtos?,80,e coronavirus transportado pelo ar ou contato,40
como voce sabe quando seu sistema imunologico esta desligando,como voce sabe quando seu sistema imunologico esta fraco,100,como voce sabe quando seu sistema imunologico esta baixo,100,como voce sabe quando seu sistema imunologico esta forte,0
como a patogenicidade do covid-19 se compara com a de outros virus,como o covid-19 se compara a outros virus?,80,como voce compara a crise covid-19 com a crise economica de 2008?,0,como o coronavirus se compara a gripe,40
o coronavirus esta melhorando na china,o coronavirus esta melhorando,10,o coronavirus esta melhorando nos eua,0,o coronavirus esta melhorando em nos,0
coronavirus posso visitar minha mae,coronavirus posso visitar minha namorada,0,coronavirus posso visitar minha familia,70,coronavirus posso visitar amigos,0
o que as autoridades de saude devem fazer para fornecer sustentabilidade aos servicos essenciais de tuberculose durante a pandemia covid-19,como as autoridades de saude podem garantir o fornecimento de medicamentos e diagnosticos para tuberculose?,0,como podemos proteger as pessoas que buscam tratamento para tuberculose durante a pandemia covid-19?,100,distribuidoras de produtos para saude podem comercializar testes para covid-19 para servicos de saude privados?,0
como faco para construir o sistema imunologico do meu filho,como faco para melhorar o sistema imunologico do meu filho,100,como construir o sistema imunologico do meu filho,100,como faco para construir o sistema imunologico do meu cachorro,0
como aumentar o sistema imunologico para lutar contra o hpv,como faco para aumentar meu sistema imunologico para lutar contra o hpv,100,como construir o sistema imunologico para lutar contra o hpv,100,como fortalecer o sistema imunologico para lutar contra o hpv,100
porque culpam ou evitam pessoas e grupos devido ao covid-19 estigmatizacao,porque covid-19 mata?,0,as pessoas estao sendo presas por deixar suas casas devido ao covid-19?,0,por que as pessoas culpam donald trump pelo surto de covid-19?,40
coronavirus filipinas e india,e coronavirus nas filipinas,40,e coronavirus na india,40,o que e coronavirus filipinas,0
voce pode pintar moveis corona,voce pode envernizar moveis corona,30,voce pode obter corona na torneira,0,voce pode misturar corona com coca,0
cobicado 19 filipinas que,cobicado 19 filipinas positivo,0,o que e cobicado 19 filipinas,0,artigo cobicado das 19 filipinas,0
como fazer a cadeia do sistema imunologico,como fazer um sistema imunologico poderoso,100,como fazer um sistema imunologico melhor,100,como fazer um bom sistema imunologico,100
virus corona em casos de delhi,virus corona em delhi hindi,60,virus corona em delhi noida,60,noticias do virus corona em delhi,60
uma pessoa pode testar negativo e depois positivo para covid-19,quem fez teste rapido em laboratorios nao corre um alto risco de ter recebido um resultado falso positivo ou negativo os testes rapidos igm/igg sao confiaveis,80,"se um profissional da equipe testar positivo para covid-19, o que a equipe devera fazer?",0,qual o tratamento indicado para uma pessoa com covid-19?,0
contagem de infeccao por coronavirus eua,contagem de infeccao por coronavirus na india,0,contagem de mortes por coronavirus nos eua,40,coronavirus nos eua contagem por estado,80
onde ocorreu a maioria dos surtos de covid-19 equino nos estados unidos,coronavirus mapa dos estados unidos,0,onde esta o coronavirus localizado nos estados unidos,0,e a preparacao dos estados unidos para a falha dos trunfos covid-19?,0
quais sao os sintomas do novo coronavirus,quais sao os sintomas do coronavirus,100,quais sao os sintomas?,100,quais sao os novos sintomas do coronavirus,90
propagacao de coronavirus nos mapeia,propagacao da doenca coronavirus,80,mapa de propagacao do virus corona,90,como impedir a propagacao de norovirus em casa,0
sintomas de coronavirus bc,quais sao os sintomas de covid-19,90,quais sintomas covid-19,90,quais os sintomas do covid-19?,90
noticias sobre coronavirus los angeles,e coronavirus em los angeles,80,coronavirus nos eua los angeles,80,noticias sobre virus corona noticias sobre a china,0
a vacina covid-19 foi encontrada,"se a vacina h1n1 foi desenvolvida tao rapidamente, por que a vacina covid-19 leva tanto tempo?",30,quando a vacina covid-19?,50,o que poderia acontecer se a cura para covid-19 nao fosse encontrada?,0
coronavirus em seattle,coronavirus em seattle wa,90,quantos casos de coronavirus em seattle,80,coronavirus news seattle,90
onde estao os casos de coronavirus em montana,casos de coronavirus no mapa dos eua hoje,80,casos de coronavirus eua,70,mapa de casos corona virus nos eua,80
quantos casos de coronavirus no condado de collin,casos coronavirus eua texas,80,quantos casos de coronavirus no condado de washoe,0,quantos casos de coronavirus no condado de kane,0
como ajudar a impulsionar o sistema imunologico do meu filho,como posso impulsionar o sistema imunologico do meu filho,80,como posso impulsionar o sistema imunologico do meu filho naturalmente,80,maneiras de impulsionar o sistema imunologico do meu filho,90
como voce sabe quando seu sistema imunologico esta forte,como voce sabe quando seu sistema imunologico esta fraco,0,como voce sabe quando seu sistema imunologico esta desligando,0,como voce sabe se seu sistema imunologico esta forte,100
os sintomas de covid-19 perduram,quanto tempo os sintomas do coronavirus duram em humanos,80,os sintomas de covid-19 sao subitos?,0,os sintomas de covid-19 aparecem rapido?,0
antipolo coronavirus filipinas,coronavirus filipinas doh,100,coronavirus filipinas gov,0,coronavirus menino filipinas,0
como o corpo reage aos virus,como o corpo reage a um virus,90,como o corpo responde aos virus,90,como os virus sao semelhantes aos parasitas,0
quais animais sao afetados por covid-19,que animais podem obter covid-19?,90,que tipos de animais sao suscetiveis ao covid-19,90,que animais podem carregar covid-19,90
o que o virus corona faz,o que o virus coronavirus faz,100,o que covid-19 faz?,100,o que o coronavirus faz,100
podemos culpar trump por covid-19,por que trump ainda esta politizando covid-19?,30,por que podemos subestimar a disseminacao de covid-19?,0,por que alguem poderia culpar ou evitar individuos e grupos (criar estigma) por causa do covid-19?,30
casos dos eua para coronavirus,coronavirus nos casos dos eua,80,coronavirus atualizam casos dos eua hoje,100,casos de coronavirus mapa dos eua,0
se estiver em isolamento posso receber pessoas em casa,posso ser despedido se ficar doente em casa?,0,o que deve ser feito para evitar que outras pessoas na casa adoecam se uma pessoa com covid-19 estiver sendo cuidada em casa?,40,tenho um idoso em casa: devo deixa-lo em isolamento social mesmo sem apresentar qualquer sintoma?,0
o virus corona se espalhara para a india,para onde o virus corona se espalhara,40,o virus corona se espalhara,40,virus corona como se espalhara,40
o virus corona como comecou,como o corona virus comecou,100,como o virus corona comecou,100,o virus corona como comecou,100
que comida aumenta o sistema imunologico,o que aumenta seu sistema imunologico,100,que vitamina aumenta seu sistema imunologico,30,o que aumenta o seu sistema imunologico alimentar,100
como melhorar a forca do sistema imunologico,como melhorar a alimentacao do sistema imunologico,0,como melhorar a saude do sistema imunologico,100,como melhorar a funcao do sistema imunologico,80
como estimular o sistema imunologico para combater o frio,como tornar o sistema imunologico forte contra o frio,100,como melhorar o sistema imunologico para combater o hpv,0,como impulsionar o sistema imunologico para combater o cancer,0
virus viral corona lewat hp xiaomi,virus corona menyebar lewat hp xiaomi,70,fakta virus corona menyebar lewat hp xiaomi,0,virus corona bisa menyebar lewat hp xiaomi,70
o que e coronavirus em ingles,o que e coronavirus ingles,80,o que e corona virus ingles,80,virus corona em ingles da china,80
noticias sobre coronavirus ontario,noticias sobre virus corona noticias sobre a china,70,coronavirus em ontario,80,coronavirus para ontario,40
coronavirus em caes contagiosos para humanos,o coronavirus em caes pode se espalhar para humanos,80,os humanos podem passar norovirus para caes,0,os caes podem passar norovirus para os humanos,0
o teste covid-19 e preciso,eu preciso fazer o teste?,0,qual modelo covid-19 e mais preciso?,75,o teste covid-19 e gratuito?,0
coronavirus nos eua confirmado,coronavirus total confirmado nos eua,70,virus corona confirmado nos eua,80,coronavirus primeiro caso confirmado nos eua,10
e coronavirus no peru,coronavirus i peru,70,coronavirus minsa peru,70,coronavirus peru pdf,70
efeitos colaterais da vacina contra cinomose canina,efeitos colaterais da vacina contra cinomose canina filhotes,40,efeitos colaterais da vacina contra o virus da cinomose canina,40,efeitos colaterais da vacina parvo canina,0
quais alimentos podem fortalecer seu sistema imunologico,quais alimentos podem construir seu sistema imunologico,100,quais alimentos ajudam a fortalecer seu sistema imunologico,100,quais alimentos comer para fortalecer seu sistema imunologico,100
quais sao os grupos de risco,quais sao os grupos considerados de risco para o covid-19?,100,quais sao os sinais / sintomas e fatores de risco para covid-19,0,quais sao os sintomas?,0
o coronavirus esta diminuindo a velocidade nos eua,o coronavirus esta diminuindo a velocidade na italia,0,o coronavirus esta diminuindo nos eua,80,o coronavirus esta diminuindo,0
o que devo fazer se ficar doente durante uma viagem,o que devo fazer se alguem em minha casa ficar doente com covid-19?,0,o que devo fazer se alguem da minha familia ficar muito doente com covid-19?,0,que cuidados devo tomar durante a viagem?,70
e coronavirus em wisconsin,coronavirus e wisconsin,100,coronavirus em wisconsin pelo condado,80,mortes por coronavirus em wisconsin,0
covid-19 foi encontrado no papel higienico,covid-19 vive no papel?,75,onde foi encontrado o coronavirus,0,covid-19 pode viver no papel?,90
farmacias e drogarias podem comercializar testes para covid-19,as distribuidoras de produtos para saude podem comercializar testes para covid-19 para qualquer estabelecimento? podem ser comercializados testes para pessoas fisicas?,80,quem pode comercializar os testes rapidos para covid-19?,80,distribuidoras de produtos para saude podem comercializar testes para covid-19 para servicos de saude privados?,70
calendario de vacinacao para parvovirus caes,esquema de vacinacao de parvovirus para caes,80,calendario vacinal para parvovirus canino,90,calendario de vacinacao contra hepatite canina,0
prevencao do coronavirus malasia,quais a medidas de prevencao,80,prevencao da doenca coronavirus,80,quais sao as principais formas de prevencao do coronavirus,80
quais sintomas de covid-19 vem primeiro,os sintomas de covid-19 vem e vao?,0,quais sintomas covid-19?,80,quais sao os sintomas de covid-19?,80
como estimular naturalmente seu sistema imunologico quando estiver doente,como posso estimular meu sistema imunologico quando estiver doente,80,como impulsionar seu sistema imunologico quando estiver doente,80,como fortalecer seu sistema imunologico quando estiver doente,80
que comida e boa para impulsionar seu sistema imunologico,que comida e boa para construir seu sistema imunologico,90,que fruta e boa para impulsionar seu sistema imunologico,75,que vitamina e boa para impulsionar seu sistema imunologico,75
sintomas de coronavirus aperto no peito,o coronavirus causa dores no peito,80,o coronavirus causa chiado no peito,75,o coronavirus causa dor no peito,80
coronavirus em cingapura,coronavirus novo em cingapura,80,coronavirus em cingapura agora,80,coronavirus em cingapura mais recente,80
quem tem risco maior para desenvolver doencas graves,quem corre maior risco de contrair doencas graves devido ao covid-19?,100,quem corre maior risco?,100,as pessoas que fumam tem maior risco de desenvolver complicacoes graves se contrairem a covid-19?,60
o coronavirus causa laringite,o coronavirus pode causar laringite,100,o coronavirus comeca com laringite,45,o coronavirus causa drenagem,0
tratamento com medicamento para coronavirus na india,tratamento com medicamento para coronavirus em hindi,75,medicamento para coronavirus encontrado na india,80,atualizacao de medicamento para coronavirus na india,80
como o virus corona e feito,e o virus corona feito,80,como o virus corona foi feito,90,e corona virus feito na china,80
significado de epidemia de coronavirus,significado de pandemia de coronavirus,90,conspiracao de epidemia de coronavirus,0,wiki de epidemia de coronavirus,40
e necessaria vacina contra cinomose canina,reacoes adversas a vacina contra cinomose canina,80,eficacia da vacina contra cinomose canina,60,vacina contra cinomose canina inativada,0
quanto tempo pode o coronavirus que causa covid-19 sobreviver em superficies,quanto tempo pode o coronavirus sobreviver em superficies diferentes,90,quanto tempo pode o coronavirus sobreviver em superficies cdc,80,o coronavirus pode sobreviver em superficies,90
coronavirus nhl,noticias do coronavirus,90,quais sao as ultimas noticias do coronavirus,90,coronavirus portugalete,0
virus corona na india causa,virus corona na india relatorio,45,virus corona na india noticias,45,virus corona na india bihar,0
e coronavirus em dc,coronavirus em washington dc,80,coronavirus nos eua washington dc,80,e coronavirus em kentucky,0
como a infeccao por norovirus e diagnosticada,como voce diagnostica infeccao por norovirus,90,como voce pega a infeccao por norovirus,0,como obter infeccao por norovirus,0
coronavirus no mapa dos eua,coronavirus no mapa dos eua georgia,0,casos de coronavirus no mapa dos eua,80,coronavirus no mapa dos eua com estados,80
coronavirus em deli india,e coronavirus em deli,90,surto de coronavirus em deli,60,e o coronavirus em deli,30
como tornar o sistema imunologico quora forte,como tornar meu sistema imunologico forte,75,como tornar seu sistema imunologico forte,75,como tornar o sistema imunologico super forte,75
informacoes relacionadas ao coronavirus,quais sao algumas dicas de viagem relacionadas ao covid-19?,40,que porcentagem das mortes de covid-19 estao relacionadas ao fumo?,0,noticias relacionadas com coronavirus na india,0
meme da indonesia do virus corona,quem corona virus da indonesia,0,virus corona no meme do mexico,0,meme do virus corona com cerveja,0
