query,per_um,ava_um,per_dois,ava_dois,per_tres,ava_tres
coronavirus em singapura hoje,e coronavirus em singapura,80,coronavirus em propriedade de singapura,70,morte por coronavirus em singapura,30
atualizacao de noticias do virus corona na china,noticias de atualizacao do corona virus china,100,noticias de atualizacao de virus corona na china,100,atualizacao de noticias de virus corona na china,100
por que donald trump esta acusando a china pela disseminacao do covid-19,o que a china esta fazendo para impedir a disseminacao do covid-19?,10,por que as pessoas culpam donald trump pelo surto de covid-19?,0,por que trump ainda esta politizando covid-19?,60
um bebe infectado com coronavirus em wuhan china,um bebe infectado pelo virus corona,40,wuhan china coronavirus em espa ol,0,coronavirus china wuhan cdc,0
onde esta o coronavirus nos eua,onde esta o coronavirus encontrado nos eua,80,onde esta o coronavirus nos eua agora,80,onde esta o coronavirus localizado nos eua,80
noticias sobre coronavirus espanha,coronavirus na espanha ultimas noticias,90,ultimas noticias corona virus espanha,80,noticias sobre virus corona noticias sobre a china,90
como construir um sistema imunologico para lutar contra o hpv,como construir seu sistema imunologico para lutar contra o hpv,100,como construir um sistema imunologico contra o hpv,100,como fortalecer o sistema imunologico para lutar contra o hpv,100
casos confirmados de coronavirus australia,casos de coronavirus na australia,90,quantos casos de coronavirus na australia,90,quantos casos de coronavirus a australia tem,70
como e o virus coronavirus,como o virus corona e detectado,20,como o virus corona e feito,60,como o virus corona e gerado,70
o ibuprofeno tera efeitos adversos em pacientes com covid-19,e seguro para pacientes com covid-19 tomar ibuprofeno?,100,os pacientes com covid-19 devem evitar o uso de ibuprofeno?,80,os pacientes de covid-19 devem tomar ibuprofeno?,90
e uma boa ideia comprar bitcoin durante a pandemia covid-19,covid-19 e uma pandemia?,0,e seguro fazer compras durante a pandemia covid-19?,65,covid-19 e uma pandemia economica?,60
e o virus corona rna ou dna,e o virus corona rna ou virus dna,100,e o virus corona um virus rna ou dna,100,o virus corona e um virus rna ou dna,100
como fumar diminui seu sistema imunologico,corro o risco de complicacoes graves devido a covid-19 se eu fumar cigarros,80,se eu fumar tabaco ou nicotina corro o risco de complicacoes por covid-19,80,o covid-19 e mais serio se voce fuma e as pessoas que fumam enfrentam os mesmos riscos ou menos,70
quantos casos de coronavirus no condado de franklin ohio,quantos casos de coronavirus em ohio por condado,70,quantos casos de coronavirus no condado,70,quantos casos de coronavirus no condado holandes,0
por que algumas pessoas sao assintomaticas enquanto outras podem ser altamente sintomaticas com o covid-19,por que tantas pessoas que contraem o covid-19 sao assintomaticas?,70,por que algumas pessoas ainda ignoram que podem pegar o virus covid-19?,0,por que algumas pessoas acreditam que covid-19 e uma arma biologica?,0
como nos coronavirus diagnosticados,como coronavirus nos eua,0,como nos o coronavirus testamos,80,como e o coronavirus nos eua,0
e coronavirus em atlanta,casos de coronavirus no mapa dos eua,80,casos de coronavirus eua por mapa estadual,90,onde esta o coronavirus no mapa dos eua,80
como melhorar seu sistema imunologico em hindi,como melhorar o sistema imunologico em hindi,100,como melhorar o sistema imunologico em casa em hindi,80,como melhorar o sistema imunologico ayurveda em hindi,65
que conselho devemos seguir contra covid-19,conselho de coronavirus nhs,35,conselho governamental de coronavirus hk,50,onde devemos investir apos o fim do covid-19?,0
como voce pode tornar seu sistema imunologico forte,como tornar seu sistema imunologico forte,100,o que voce pode comer para tornar seu sistema imunologico forte,100,o que voce pode fazer para tornar seu sistema imunologico forte,100
casos de coronavirus em massachusetts,quantos casos de coronavirus em massachusetts,100,mapa de casos de coronavirus em massachusetts,100,casos de coronavirus em massachusetts por condado,100
onde esta o coronavirus nos eua agora,onde esta o coronavirus agora,35,onde esta o coronavirus nos eua,80,coronavirus nos eua agora,90
como faco para aumentar o sistema imunologico do meu filho,como faco para melhorar o sistema imunologico do meu filho,100,como aumentar o sistema imunologico do meu filho,100,como faco para aumentar meu sistema imunologico nhs,0
o coronavirus pode viver no casaco de caes,quanto tempo o coronavirus permanece em superficies diferentes,80,por quanto tempo os germes do coronavirus podem viver nas superficies,80,quanto tempo covid-19 vive em superficies,80
sinais de que voce tem sistema imunologico baixo,sinais de que voce tem sistema imunologico fraco,100,sinais de que voce tem um forte sistema imunologico,65,sinais de que voce tem um sistema imunologico saudavel,65
como e chamado o coronavirus,por que o coronavirus e chamado assim,35,por que e chamado de covid-19?,35,como e chamado quando seu sistema imunologico esta fraco,0
o profissional de enfermagem com sintomas que cumpriu o isolamento domiciliar apos 14 dias pode retornar ao trabalho,fui confirmado com a covid-19: apos os 14 dias de isolamento posso ter contato com idosos?,100,o que significa isolamento domiciliar?,0,o que e isolamento domiciliar?,0
como o coronavirus se formou,como o coronavirus se espalhou,0,como o coronavirus se sente,0,como o coronavirus se origina,100
o coronavirus afeta a visao,como covid-19 afeta o corpo,80,coronavirus afeta quais rgos,80,o coronavirus afeta a comida chinesa,0
ha um procedimento a seguir se covid-19 matar um membro da minha familia no exterior,se um membro da familia adoece desde covid-19 o que eu faco?,70,ha algo que eu possa fazer para ajudar minha familia a se preparar para covid-19?,0,devo cancelar a minha viagem para o exterior?,0
o covid-19 pode se espalhar pelos alimentos,o coronavirus pode se espalhar pelos olhos,0,o coronavirus pode se espalhar pelos ouvidos,0,o coronavirus pode se espalhar pelos ovos,65
coronavirus china chicago,casos de coronavirus em chicago,90,coronavirus em chicago,80,coronavirus novo chicago,80
o que as pessoas com alto risco de doencas graves com covid-19 devem fazer,o que as pessoas que pertencem ao grupo de risco devem fazer?,100,as pessoas com deficiencia correm maior risco?,30,quem corre o risco de desenvolver doencas graves?,0
contagem de coronavirus no paquistao,casos de coronavirus no paquistao,90,pacientes coronavirus no paquistao,80,e coronavirus no paquistao,70
o que esta acontecendo na china coronavirus,o coronavirus esta diminuindo na china,45,o coronavirus esta melhorando na china,45,o coronavirus esta desacelerando na china,45
como estimular seu sistema imunologico ao tomar antibioticos,como estimular seu sistema imunologico apos tomar antibioticos,90,como estimular o sistema imunologico apos tomar antibioticos,90,como estimular o sistema imunologico ao tomar metotrexato,0
o que e novo coronavirus 2019-ncov,o que e novo coronavirus,0,coronavirus 2019-ncov ncbi,70,coronavirus 2019-ncov hopkins,70
o coronavirus chegou a vancouver,como o coronavirus chegou a china,0,como o coronavirus chegou a italia,0,coronavirus news vancouver,70
por que tantas pessoas acreditam que ha uma conexao entre a tecnologia covid-19 e 5g,essa pandemia tem algo a ver com a rede 5g,80,e verdade que 5g espalha o covid-19,80,por que tantas pessoas morreram de covid-19 nos eua?,0
plano do governo do reino unido coronavirus,conselho do governo do reino unido coronavirus,90,anuncio do governo do reino unido coronavirus,45,coronavirus financiamento do governo do reino unido,80
areas afetadas pelo virus corona na italia,areas afetadas por coronavirus na italia,100,areas afetadas por coronavirus na china,0,areas afetadas por coronavirus na india,0
animais domesticos podem ser infectados com covid-19 e entao transmiti-lo a outros animais de estimacao e seres humanos,animais de estimacao podem pegar coronavirus,60,devo evitar o contato com animais de estimacao ou outros animais se estiver doente com covid-19?,0,animais de estimacao podem pegar ou transmitir a covid-19?,90
quais alimentos estimulam o sistema imunologico de uma crianca,quais alimentos estimulam seu sistema imunologico,70,quais alimentos estimulam o sistema imunologico de um cao,0,quais alimentos estimulam o sistema imunologico para combater infeccoes,0
o coronavirus se espalha pelo frango,o virus corona se espalha pelo frango na india,70,o coronavirus pode se espalhar pelo frango,90,o coronavirus se espalha pelo ovo,30
existe um jeito certo de lavar as maos,"provavelmente pegarei o virus covid-19 na america, independentemente de lavar as maos?",0,existe uma maneira de matar covid-19 sem desinfetante para as maos?,0,"por que? lavar as maos com agua e sabao ou usar alcool nas maos elimina o virus, se este estiver nas maos.",20
como o corpo humano mata os virus,como o corpo humano luta contra os virus,100,como o corpo mata os virus do resfriado,60,como seu corpo mata virus,100
e coronavirus bacteriano,o que e coronavirus e e contagioso,0,e o coronavirus e las vegas,0,qual e o coronavirus e sintomas,30
comida para impulsionar o sistema imunologico em criancas,vitaminas para impulsionar o sistema imunologico em criancas,35,comida para impulsionar o sistema imunologico nhs,60,comida para impulsionar o sistema imunologico rapido,65
coronavirus nos eua nyc,onde estao os casos de coronavirus nos eua,90,"coronavirus nos eua, onde",80,mapa de casos confirmados de coronavirus nos eua,90
por que se preocupar com covid-19 quando a gripe mata tantas pessoas,por que tantas pessoas morreram de covid-19 nos eua?,0,por que tantas pessoas que contraem o covid-19 sao assintomaticas?,0,devo me preocupar com a covid-19?,70
as mortes de covid-19 devem ser cremadas,as mortes de covid-19 sao precisas?,0,as mortes de covid-19 atingiram o pico?,0,as gestantes e lactante devem ser afastadas da assistencia?,0
como fazer quando os clientes devido ao teor do servico prestado nao podem usar mascara por exemplo tratamentos de rosto cortar a barba comer etc,por que os animais estao sendo testados quando muitas pessoas nao podem fazer o teste?,0,como usar uma mascara?,0,devo usar mascara de protecao ao deixar o brasil?,0
como impulsionar o sistema imunologico nhs,como impulsionar o sistema imunologico naturalmente nhs,70,como posso impulsionar meu sistema imunologico nhs,90,como voce pode impulsionar seu sistema imunologico nhs,90
como fortalecer o sistema imunologico durante a viagem,voce pode melhorar o sistema imunologico,60,ajudar seu sistema imunologico a ficar mais forte,80,como aumentar seu sistema imunologico,80
como se manter saudavel com um sistema imunologico comprometido,como se manter saudavel com um sistema imunologico fraco,100,como manter um sistema imunologico saudavel,40,como posso manter um sistema imunologico saudavel,40
deve covid-19 ser capitalizado,qual modelo covid-19 deve ser usado?,0,a morte de covid-19 deve ser cremada?,0,covid-19 deve ser relatado na certidao de obito?,0
seu sistema imunologico esta mais fraco durante a gravidez,seu sistema imunologico esta mais fraco durante o inicio da gravidez,100,seu sistema imunologico e mais forte ou mais fraco durante a gravidez,80,e o sistema imunologico mais fraco durante a gravidez,90
coronavirus philippines pasay city,casos de virus corona nas filipinas,90,ultimas noticias do virus corona nas filipinas,80,ultimas noticias sobre o virus corona nas filipinas,90
tomar vitamina c e propolis ajuda a prevenir contra o virus,pode tomar vitamina c aumentar a resistencia de seu corpo ao covid-19?,80,que vitamina ajuda a construir seu sistema imunologico,60,que vitamina ajuda a impulsionar seu sistema imunologico,60
coronavirus podem os humanos obter,os humanos podem pegar coronavirus,100,os humanos podem obter o novo coronavirus de caes e gatos,65,os humanos podem usar pomada corona,0
o virus corona morrera a que temperatura,o virus corona morrera em que temperatura,100,o coronavirus morrera em temperatura alta,100,a que temperatura o virus corona nao sobrevive,100
como evitar que o norovirus se espalhe,como o norovirus se espalha,35,e possivel que sangue doado espalhe covid-19?,0,como um norovirus se espalha,90
coronavirus pelo ar,e coronavirus transportado pelo ar,90,norovirus se espalhou pelo ar,0,o coronavirus pode viajar pelo ar,80
por quanto tempo voce pode ter norovirus antes dos sintomas,por quanto tempo voce pode ter norovirus por,80,voce pode espalhar norovirus antes dos sintomas,0,quanto tempo voce pode ter norovirus,70
covid-19 veio de um laboratorio,covid-19 veio de um morcego?,0,covid-19 comecou em um laboratorio?,100,covid-19 escapou de um laboratorio de pesquisa?,100
areas afetadas por coronavirus na china,areas afetadas por coronavirus na italia,0,areas afetadas por coronavirus na india,0,areas afetadas pelo virus corona na china,100
voce pode espalhar o norovirus antes que os sintomas comecem,voce pode espalhar norovirus antes dos sintomas,100,voce pode espalhar norovirus sem sintomas,100,como voce pode espalhar norovirus,80
onde esta o coronavirus agora no reino unido,"coronavirus no reino unido, onde",100,onde esta o coronavirus reino unido,100,onde esta o coronavirus agora,100
voce pode espalhar norovirus sem sintomas,voce pode transmitir o norovirus sem sintomas,100,voce pode espalhar norovirus antes dos sintomas,100,o coronavirus pode se espalhar sem sintomas,0
ajudar seu sistema imunologico a ficar mais forte,o que ajuda seu sistema imunologico a ficar mais forte,100,alimentos que ajudam seu sistema imunologico a ficar mais forte,70,seu sistema imunologico fica mais forte depois de ficar doente,0
como faco para saber se meu sistema imunologico esta saudavel,como faco para saber se meu sistema imunologico esta fraco,65,como faco para saber se meu sistema imunologico esta comprometido,65,como faco para saber se meu sistema imunologico esta suprimido,65
atualizacao sobre coronavirus em nz,atualizacao do coronavirus nz,90,noticias sobre coronavirus nz,90,casos de atualizacao de coronavirus nz,90
vacina de coronavirus canino de vanguarda,vacina de parvovirus canino,0,vacina de coronavirus canino zoetis,0,tipo de vacina de parvovirus canino,50
como o coronavirus e curado,o coronavirus esta curado,80,coronavirus curado australia,65,o coronavirus pode ser curado,70
o coronavirus tem febre,o coronavirus tem febre alta,70,o coronavirus causa febre,80,o covid-19 provoca febre?,90
o tratamento da tuberculose e diferente em pessoas com tb e covid-19,qual o tratamento indicado para uma pessoa com covid-19,70,o covid-19 e a tuberculose se propagam da mesma forma?,0,"e provavel que as pessoas com tuberculose tenham maior risco de infeccao, doenca e morte por covid-19?",0
e coronavirus no texas,e coronavirus no sul do texas,50,coronavirus no texas confirmado,70,coronavirus no texas 2020,70
coronavirus na coreia,coronavirus na coreia 2020,80,atualizacao de coronavirus na coreia,80,coronavirus na coreia ultimas noticias,80
quantas mortes de covid-19 na ultima semana,quantas mortes por coronavirus na ultima semana,100,qual e o numero atual de mortes devido a covid-19,80,qual e o numero previsto de mortes devido a covid-19,80
coronavirus delhi ndtv,coronavirus em delhi,0,coronavirus e delhi,70,coronavirus em delhi noida,0
coronavirus singapura dfat,peticao coronavirus singapura,0,coronavirus em singapura hoje,70,e coronavirus em singapura,70
pode baixo sistema imunologico causar infeccao por fungos,como o corpo luta contra virus bacterias fungos,50,pode baixo sistema imunologico causar infertilidade,0,pode baixo sistema imunologico causar aborto,0
o desinfetante para as maos e util,pode o desinfetante caseiro substituir desinfetante para as maos de verdade?,80,posso matar covid-19 sem desinfetante para as maos?,80,posso usar vodka como desinfetante para as maos?,0
como voce estimula um sistema imunologico fraco,como voce estimula o sistema imunologico de um cao,0,como voce fortalece um sistema imunologico fraco,100,como voce tem um sistema imunologico fraco,0
o que posso fazer para impulsionar meu sistema imunologico rapido,o que posso fazer para impulsionar meu sistema imunologico naturalmente,65,o que posso fazer para impulsionar o sistema imunologico do meu filho,70,o que posso fazer para manter meu sistema imunologico forte,70
como desenvolver o sistema imunologico em adultos,como desenvolver o sistema imunologico em bebes,0,como aumentar o sistema imunologico em adultos,100,como fortalecer o sistema imunologico em adultos,100
