query,per_um,ava_um,per_dois,ava_dois,per_tres,ava_tres
como construir o sistema imunologico durante a quimio,como fortalecer meu sistema imunologico durante a quimio,100,como construir seu sistema imunologico apos a quimio,100,mantendo o sistema imunologico forte durante a quimio,100
coronavirus no quirguistao ultimas noticias,coronavirus no quirguistao bishkek,80,coronavirus ultimas noticias no paquistao,0,ultimas noticias sobre coronavirus no canada,0
como construir o sistema imunologico quando doente,como aumentar o sistema imunologico quando doente,100,como melhorar o sistema imunologico quando doente,100,como impulsionar o sistema imunologico quando doente,100
casos de coronavirus na africa,casos de coronavirus na africa do sul,10,quantos casos de coronavirus na africa do sul,70,casos de virus corona na africa do sul,90
quantos casos de coronavirus em augusta ga,casos de coronavirus em ga,70,coronavirus em ga,90,quantas mortes por coronavirus em ga,80
em que o virus corona animal encontrado,animal de origem do virus corona,100,e o virus corona encontrado em frango,60,coronavirus e causado por qual animal,80
como o coronavirus se compara a gripe,como o coronavirus se compara a praga,10,como o coronavirus se compara,50,como o covid-19 se compara a outros virus?,70
como voce deixa seu sistema imunologico mais forte,como voce pode tornar seu sistema imunologico mais forte,100,como seu sistema imunologico fica mais forte,100,como tornar seu sistema imunologico mais forte,100
como ter certeza de que seu sistema imunologico e forte,como ter um sistema imunologico forte e saudavel,60,como posso ter certeza de que meu filho continua recebendo sua educacao?,0,como dizer que seu sistema imunologico e forte,90
quanto tempo leva para o virus corona mostrar os sintomas,quanto tempo leva para o virus corona mostrar os sintomas,100,quanto tempo o coronavirus leva para mostrar os sintomas,100,quanto tempo leva o coronavirus para mostrar os sintomas,100
quais medidas estao sendo tomadas para proteger os eua suprimento de sangue do virus que causa covid-19,quais sao as medidas de seguranca tomadas globalmente para prevenir covid-19?,0,que medidas os pais devem tomar para proteger os filhos?,0,por quais razoes os funcionarios do hospital estao sendo expostos ao covid-19?,0
mapa de infeccao do virus corona,mapa do virus corona de casos americanos,40,mapa de infeccao covid-19 eua,40,dados gis do mapa de infeccao por coronavirus,80
que medidas devem ser tomadas para garantir que agua potavel seja usada na producao de alimentos durante esta pandemia,como as instalacoes de alimentos devem ser limpas / desinfetadas durante esta pandemia?,50,que medidas adicionais devem ser tomadas nos locais de trabalho e para empregos de alto risco?,10,que medidas adicionais devem ser tomadas nos locais de trabalho e para empregos de medio risco?,10
quais sao os sintomas mais comuns de covid-19,quais sao alguns equivocos comuns sobre covid-19?,0,quais sao os sintomas?,70,quais sao os sintomas da covid-19,70
tratamento com coronavirus hku1,tratamento com medicamento para coronavirus,50,coronavirus hku1 rna,0,coronavirus hku1 2020,0
vacina contra coronavirus romenia,vacina contra coronavirus,60,e coronavirus na romenia,80,vacina contra cinomose canina contra sarampo,0
coronavirus na florida ultimas noticias,coronavirus na florida,80,coronavirus e florida,80,coronavirus nos eua florida,80
o que e bom para um sistema imunologico saudavel,o que e um bom suplemento para o sistema imunologico,60,o que levar para um sistema imunologico saudavel,80,o que comer para um sistema imunologico saudavel,80
coronavirus posso andar la fora,coronavirus posso correr la fora,100,coronavirus voce pode ir la fora,80,o coronavirus esta no ar la fora,80
o lisol diz que mata o coronavirus,o que e coronavirus humano em lisol,70,o que a fe islamica diz sobre covid-19?,0,e coronavirus em lisol,80
e verdade que 5g espalha o covid-19,e verdade que aqueles que receberam vacinacao bcg teriam imunidade contra covid-19?,0,por que tantas pessoas acreditam que ha uma conexao entre a tecnologia covid-19 e 5g?,100,e verdade que os tipos de sangue o + sao imunes ao covid-19?,0
o que posso fazer se meu filho tiver dificuldades para se ajustar a novas rotinas e seguir as recomendacoes,como posso me preparar caso a creche escolar ou a universidade do meu filho seja dispensada,50,como posso ter certeza de que meu filho continua recebendo sua educacao?,45,posso tocar e segurar meu bebe recem-nascido se eu tiver covid-19?,0
o covid-19 ira embora,o covid-19 ira embora no verao?,60,o covid-19 ira embora na primavera?,60,o covid-19 algum dia ira embora?,100
covid-19 e curavel,coronavirus e curavel,100,e coronavirus curavel em humanos,100,coronavirus e curavel ou nao,100
vacina contra coronavirus para caes,vacina contra coronavirus em caes,100,vacina contra cinomose canina em caes,0,vacina de coronavirus para caes,100
casos confirmados de coronavirus em arkansas,onde estao os casos de coronavirus em arkansas,90,e coronavirus em arkansas,80,casos confirmados de coronavirus em nos,0
como manter seu sistema imunologico forte e saudavel,como manter o sistema imunologico forte e saudavel,100,como manter seu sistema imunologico saudavel,80,como manter seu sistema imunologico forte,80
quais alimentos aumentam meu sistema imunologico,quais alimentos aumentam o sistema imunologico,100,quais alimentos aumentam naturalmente o seu sistema imunologico,100,quais alimentos e bebidas aumentam seu sistema imunologico,100
virus corona da india confirmado,virus corona da india mumbai,0,bangalore virus corona da india,0,virus corona da india afetado,70
a oms recomenda o uso de mascaras com valvulas expiratorias para prevenir a transmissao de covid-19,que tipo de mascaras sao recomendadas para proteger os profissionais de saude da exposicao ao covid-19,60,e recomendado o uso de mascaras de protecao,40,o que a oms recomenda para usuarios de tabaco?,0
novo mapa de infeccao por coronavirus,novo tratamento para infeccao por coronavirus,0,dados gis do mapa de infeccao por coronavirus,80,mapa do pais com infeccao por coronavirus,80
existe alguma orientacao especifica para gestantes que comecem a apresentar sintomas de covid-19,gravidas correm risco maior,80,as mulheres gravidas com covid-19 tem risco aumentado de desfecho adverso na gravidez,70,covid-19 e especialmente prejudicial para mulheres gravidas,70
quantos casos de coronavirus em west hollywood,casos de coronavirus mapa dos eua,80,mapa de infeccao covid-19 eua,80,onde esta o coronavirus no mapa dos eua,80
que alternativas eu tenho se nao houver desinfetantes para as maos disponiveis,"se eu nao conseguir encontrar desinfetante para as maos na loja, posso fazer o meu?",100,eu tenho permissao para sair?,0,devo fazer meu proprio desinfetante para as maos se nao conseguir encontra-lo nas lojas?,100
por quanto tempo voce vomita com norovirus,por quanto tempo voce pode ser contagioso com norovirus,0,quanto tempo voce permanece contagioso com norovirus,0,quanto tempo voce fica contagioso com norovirus,0
o coronavirus afetara a industria da construcao,o coronavirus esta afetando a construcao,100,o coronavirus afetara a internet,0,o coronavirus afetara a voz,0
covid-19 esta minando nossa liberdade,como o covid-19 afetara nossa geracao?,20,o covid-19 mudara a nossa politica?,0,coronavirus e nossa patente,10
o coronavirus esta espalhado pelo ar,o coronavirus esta espalhado no ar,80,coronavirus espalhado pelo dinheiro,0,coronavirus espalhado pelo correio,0
paquistao coronavirus 4 casos,casos de coronavirus no paquistao,80,casos de coronavirus noticias no paquistao,80,casos confirmados de coronavirus no paquistao,80
quantos casos confirmados de coronavirus em nos,casos confirmados de coronavirus em nos,100,quantos casos confirmados de coronavirus em idaho,0,quantos casos confirmados de coronavirus em maine,0
por que os negros americanos estao morrendo em maior numero desde covid-19,por que os trabalhadores medicos estao adoecendo ou morrendo de covid-19 se eles estao usando equipamentos de protecao?,0,por que os americanos sao a nacao mais afetada do mundo por covid-19?,50,por que os politicos mundiais estao subestimando covid-19?,0
coreia do sul covid localizacao de 19 casos,covid 19 coreia do sul,70,covid 19 casos da coreia do sul,80,covid 19 coreia do sul cingapura,0
corona virus quanti casi na germania,coronavirus na europa mapa,80,coronavirus no mapa da europa ,80,em piemonte quanti casi di corona virus ci sono,0
voce esta entediado de ficar em casa devido a covid-19,por quanto tempo o publico americano esta disposto a ficar em casa devido a covid-19?,70,a china ainda esta bloqueada devido a covid-19?,0,devemos ficar em casa para nos proteger?,40
posso passar alcool gel na mao de recem-nascidos e criancas,diante da falta de alcool gel podemos colocar gel de cabelo no alcool 70 liquido como alternativa?,0,"o alcool 92% e eficiente? e o alcool de cereais 93%, eles tem a mesma funcao do alcool gel 70%?",0,o alcool em gel substitui a lavagem com agua e sabao?,50
status do coronavirus no ira,ultimas noticias do virus corona no ira,80,casos de coronavirus no ira,80,status do coronavirus na india,0
voce pode ter dois virus ao mesmo tempo,posso ter gripe e covid-19 ao mesmo tempo,80,quanto tempo voce pode ter o norovirus,0,por quanto tempo voce pode ter norovirus por,0
noticias falsas sobre coronavirus india,noticias sobre coronavirus na india,80,ultimas noticias sobre coronavirus na india,80,noticias sobre coronavirus india em marati,40
e se meu filho precisar ir ao hospital,quem deve ir ao hospital,80,o que farao comigo quando eu chegar no hospital ou posto de saude,75,"se nao ha cura, por que ir ao hospital a menos que tenha problemas respiratorios?",0
foi o homem covid-19 feito,o covid-19 foi feito em um laboratorio,100,coronavirus e feito pelo homem,100,coronavirus feito pelo homem hiv,70
mapa-mundi do contador em tempo real da pandemia de coronavirus,pandemia de coronavirus em tempo real,80,contador de pandemia de coronavirus,90,contagem de mapas mundiais em tempo real de pandemia de coronavirus,100
quantos casos de coronavirus em israel,casos de coronavirus em israel hoje,100,e coronavirus em israel,100,vacina de coronavirus israel,0
vacina para o coronavirus,existe vacina para covid-19?,100,existe uma vacina para o coronavirus?,100,vacina de coronavirus para caes,50
como manter o sistema imunologico forte durante a gravidez,como manter o sistema imunologico ativo durante a gravidez,100,como manter seu sistema imunologico saudavel durante a gravidez,100,como manter o sistema imunologico forte durante a quimioterapia,0
coronavirus em condados de michigan,coronavirus em quarentena de michigan,30,coronavirus em casos de michigan,70,casos de coronavirus em michigan,50
o coronavirus pode causar nauseas,pode o coronavirus causar tontura,90,pode o coronavirus causar vomito,30,o coronavirus pode causar nausea,100
o virus corona se espalha pelo frango,o coronavirus se espalha pelo frango,100,o virus corona se espalha pelo ovo,50,o coronavirus pode se espalhar pelo frango,100
onde posso fazer os testes rapidos igm/igg,o que sao testes rapidos (igm/igg)?,30,e os testes rapidos?,50,o que sao os testes rapidos?,20
por que as pessoas estao mais preocupadas em voltar ao trabalho do que em ficar em casa ate que o virus covid-19 melhore,devo ir trabalhar se houver um surto na minha comunidade,60,como faco para saber se devo parar de trabalhar,50,quanto tempo as pessoas com covid-19 devem ficar em casa e isoladas?,0
quantos casos do coronavirus existem nos estados unidos,quantos casos do coronavirus nos estados unidos,100,quantos casos de coronavirus nos estados unidos,100,quantos casos do coronavirus foram encontrados nos estados unidos,100
se o resultado do teste rapido igm/igg for positivo isso indica que tenho covid-19,que teste devo fazer para ver se tenho covid-19?,0,quem fez teste rapido em laboratorios nao corre um alto risco de ter recebido um resultado falso positivo ou negativo? os testes rapidos (igm/igg) sao confiaveis?,35,o que aconteceria se o teste de trunfo fosse positivo para covid-19?,0
coronavirus e chicago,coronavirus china chicago,0,coronavirus novo chicago,70,coronavirus chicago univision,35
qual virus corona animal espalhou,virus corona espalhado por qual animal,0,virus corona e transmitido de qual animal,0,qual animal e a causa do virus corona,35
quanto tempo leva para as pessoas infectadas apresentarem os sintomas,por quanto tempo as pessoas permanecem infectadas com covid-19?,0,virus corona quanto tempo leva para mostrar os sintomas,100,quanto tempo leva o coronavirus para mostrar os sintomas,100
como lidar com um sistema imunologico fraco,como se livrar de um resfriado com um sistema imunologico fraco,10,como curar um sistema imunologico fraco,90,como testar um sistema imunologico fraco,0
covid 19 malaysia caso 26,covid 19 malaysia uda,25,covid 19 malaysia berita,25,covid 19 malaysia moh,25
o coronavirus teve origem no laboratorio do governo chines,o coronavirus se originou no laboratorio chines,100,laboratorio de origem de coronavirus,80,coronavirus no mercado chines,0
atualizacoes de coronavirus nos,atualizacao de coronavirus nos eua,80,qual e a atualizacao sobre coronavirus nos eua,80,atualizacoes do coronavirus nyc,0
prevencao do coronavirus alemanha,prevencao do coronavirus malasia,0,atualizacao do coronavirus na alemanha,35,prevencao do virus corona na india,0
e coronavirus em perth,casos de coronavirus na australia,80,casos confirmados de coronavirus na australia,80,noticias sobre coronavirus australia,80
o que levar para um sistema imunologico saudavel,o que levar para o sistema imunologico baixo,0,o que levar para o sistema imunologico fraco,0,o que levar para aumentar o sistema imunologico,90
como o virus corona afeta o ser humano,como o coronavirus afeta o corpo humano,100,como o virus corona afeta o corpo,100,como o virus corona afeta os humanos,100
as vacinas covid-19 serao eficazes uma vez que uma pessoa recuperada pode contrair o virus novamente,pode uma pessoa jovem e saudavel morrer de uma infeccao covid-19?,0,voce pode pegar um covid-19 mais de uma vez?,60,o coronavirus pode matar uma pessoa saudavel,0
onde esta o coronavirus agora mapa,onde esta o coronavirus agora nos eua,35,onde esta o coronavirus nos eua agora,35,onde esta o mapa do coronavirus,90
mortes por coronavirus no reino unido ontem,mortes por coronavirus no reino unido por idade,65,mortes por coronavirus no reino unido por dia,70,mortes por coronavirus no reino unido por regiao,70
o que e coronavirus humano em lisol,o que e coronavirus humano,0,o lisol diz que mata o coronavirus,10,e coronavirus na lata de lisol,80
o que e periodo de incubacao cobicado,o que e o periodo de incubacao de covid-19s?,50,o que e o periodo de incubacao do coronavirus,70,"o que e o ""periodo de incubacao""?",80
covid-19 realmente se originou da provincia da china ou simplesmente foi descoberto la,onde covid-19 se originou?,80,a taxa de recuperacao muito alta da china de covid-19 e realmente precisa?,0,a administracao trump realmente herdou um teste covid-19 defeituoso ou desatualizado da administracao obama?,0
como o coronavirus se compara a praga,como o coronavirus se compara,50,como o coronavirus se compara a gripe suina,0,como o covid-19 se compara a outros virus?,40
o que torna meu sistema imunologico mais forte,o que torna seu sistema imunologico mais forte,100,que vitamina torna o seu sistema imunologico mais forte,40,beijar torna seu sistema imunologico mais forte,30
ouvi falar que a cloroquina e hidroxicloroquina estao sendo usadas de forma eficaz para o tratamento da covid- 19. se eu ficar doente devo usar tambem,o que devo fazer se ficar doente durante uma viagem?,30,quando eu devo usar luvas?,0,o que devo fazer se alguem da minha familia ficar muito doente com covid-19?,30
coronavirus covid 19 casos globais pelo centro de sistemas,coronavirus covid 19 casos globais pelo centro de ciencia de sistemas e engenharia csse em johns,70,coronavirus covid 19 casos globais pelo centro para o sistema,60,casos globais de coronavirus covid-19 pelo centro de ciencia e engenharia de sistemas,70
coronavirus e canada,coronavirus e encontrado no canada,80,coronavirus no canada,90,coronavirus pandemico canada,80
como o sistema imunologico pode combater os virus,como combater o virus no corpo,80,como o sistema imunologico combate os virus,90,como o sistema imunologico mata os virus,90
qual e o tamanho do bovino covid-19,qual e o tamanho do genoma do covid-19?,0,qual e a estrutura molecular do covid-19 bovino?,70,a estrutura do bovino covid-19 e conhecida?,70
esquema de vacinacao parvo para caes,parvo vacinal caes,90,calendario de vacinacao para parvovirus caes,50,vacinacao contra parvovirus canino para caes,90
casos de coronavirus na grecia,coronavirus na grecia,100,e coronavirus na grecia,100,atualizacao do coronavirus na grecia,100
quais vegetais sao bons para o seu sistema imunologico,quais alimentos sao bons para construir seu sistema imunologico,100,quais alimentos sao bons para impulsionar seu sistema imunologico,100,quais alimentos sao bons para fortalecer seu sistema imunologico,100
quanto tempo e o periodo de incubacao para covid-19,quanto tempo e o tempo de incubacao para covid-19?,100,qual e o periodo de incubacao?,100,o que e periodo de incubacao cobicado,30
cidade de origem do coronavirus,cdc de origem do coronavirus,30,guerra de origem do coronavirus,0,coala de origem do coronavirus,0
casos globais de coronavirus covid-19 pelo centro de ciencia e engenharia de sistemas,coronavirus covid 19 casos globais pelo centro de sistemas,100,coronavirus covid 19 casos globais pelo centro,0,coronavirus covid 19 casos globais pelo centro para o sistema,0
e coronavirus em singapura,coronavirus em propriedade de singapura,90,morte por coronavirus em singapura,90,impacto do coronavirus em singapura,50
qual dieta estimula seu sistema imunologico,o que estimula seu sistema imunologico,80,que medicamento estimula seu sistema imunologico,10,que fruta estimula seu sistema imunologico,90
voce tem um sistema imunologico melhor durante a gravidez,voce tem um sistema imunologico fraco durante a gravidez,60,voce tem um sistema imunologico baixo durante a gravidez,60,melhor sistema imunologico durante a gravidez,80
quando covid-19 vai parar,o clima quente vai parar o surto de covid-19?,0,quando todo mundo vai levar covid-19 a serio?,0,como faco para parar covid-19?,10
ultimas noticias sobre o virus corona em hyderabad,ultimas noticias corona virus hyderabad,100,ultimas noticias sobre coronavirus em hyderabad,100,ultimas noticias sobre coronavirus hyderabad,100
covid-19 pode viver em superficies,o coronavirus pode viver em superficies cdc,100,quanto tempo pode o coronavirus viver em superficies,80,o coronavirus pode viver em superficies de papel,70
o coronavirus esta atingindo o pico,quando o covid-19 alcancara seu pico?,90,os casos de covid-19 atingiram o pico?,100,as mortes de covid-19 atingiram o pico?,60
o coronavirus causa tosse convulsa,o coronavirus causa tosse umida,0,o coronavirus sempre tem tosse,40,o que e uma tosse coronavirus,30
como impulsionar seu sistema imunologico apos a gripe,como construir o sistema imunologico apos a gripe,100,como estimular o sistema imunologico apos a gripe,100,como impulsionar seu sistema imunologico apos antibioticos,0
maneiras naturais de tornar seu sistema imunologico mais forte,maneiras naturais de manter seu sistema imunologico forte,100,maneiras de tornar meu sistema imunologico mais forte,50,maneiras naturais de melhorar seu sistema imunologico,100
coronavirus e a russia,e coronavirus na russia,90,qual e a situacao do coronavirus na russia,90,o coronavirus esta afetando a russia,90
teste de vacina contra coronavirus,resultados do teste de vacina contra coronavirus,100,voluntario para teste de vacina contra coronavirus,40,atualizacao de teste de vacina de coronavirus,100
o que e distanciamento social e por que e importante,por que o teste covid-19 e importante?,0,por que e importante ter um sistema imunologico saudavel,0,o que aconteceria se simplesmente deixassemos o covid-19 seguir seu curso e nao praticar o distanciamento social?,60
numero de mortes por coronavirus no estado de washington,coronavirus no estado de washington,60,numero de mortes por coronavirus no ira,0,e coronavirus no estado de washington,70
como o coronavirus afeta humanos,como o virus corona afeta os humanos,100,como covid-19 afeta o corpo?,100,como o coronavirus afeta o corpo,100
o coronavirus causa perda de peso,o coronavirus causa perda de cheiro,0,o coronavirus causa perda de apetite,0,o coronavirus causa perda auditiva,0
o covid-19 pode ser transmitido atraves da amamentacao,o coronavirus pode ser transmitido atraves da respiracao,0,o covid-19 pode ser transmitido atraves do sexo?,0,o coronavirus pode ser transmitido atraves dos mosquitos,0
e o virus corona nos eua,virus corona nos eua seattle,60,virus corona e eua,80,onde esta o virus corona nos eua,70
coronavirus voce ainda pode fazer sexo,coronavirus voce ainda pode fazer caminhadas,0,e seguro fazer sexo neste momento?,100,pode corona fazer voce vomitar,0
o que e coronavirus nz,coronavirus nz arauto,0,coronavirus nz auckland,0,noticias sobre coronavirus nz,0
atualizacao do coronavirus na florida,coronavirus na florida,80,quantos casos do coronavirus existem na florida,80,atualizacao do coronavirus na california,0
como covid-19 esta infectando worekrs medicos,como os medicos aumentam seu sistema imunologico,0,como os trabalhadores medicos estao sendo infectados?,100,existem vacinas ou outros produtos medicos para prevenir covid-19?,0
quanto tempo as pessoas com covid-19 devem ficar em casa e isoladas,quanto tempo devem ficar afastadas pessoas que tiveram contato com caso suspeito ou confirmado?,70,por que nao sao apenas as pessoas de risco que precisam ficar isoladas?,30,como as pessoas na mesma casa devem se preparar para covid-19?,50
coronavirus primeiro caso confirmado no municipio de santa clara,quando foi identificado o primeiro caso de covid-19,60,ph primeiro caso de coronavirus,0,eua primeiro caso de coronavirus,0
quais vitaminas fortalecem seu sistema imunologico,quais vitaminas fortalecem o sistema imunologico,100,quais suplementos fortalecem seu sistema imunologico,100,quais alimentos fortalecem seu sistema imunologico,0
como fortalecer o sistema imunologico para lutar contra o hpv,como aumentar o sistema imunologico para lutar contra o hpv,100,como construir o sistema imunologico para lutar contra o hpv,100,impulsionando o sistema imunologico para lutar contra o hpv,100
os humanos podem passar norovirus para caes,os caes podem transmitir norovirus aos humanos,0,voce pode passar norovirus para caes,100,os humanos podem pegar coronavirus de caes,0
se infectado com covid-19 voce pode sobreviver e se recuperar,voce pode pegar covid-19 se ja estiver com gripe?,0,coronavirus voce pode sobreviver,100,e possivel espalhar o covid-19 depois de se recuperar dele?,0
o coronavirus faz voce sentir nauseas,o coronavirus faz voce tossir muco,0,o coronavirus faz voce tossir sangue,0,o que o coronavirus faz com voce,40
sera que o covid-19 levara a demanda por democracia na china,por que a china nao se desculpa por causar covid-19?,40,sera que o covid-19 realmente nos colocara na lei marcial?,0,a internet sera encerrada durante covid-19?,0
como fazer um sistema imunologico enfraquecido,como melhorar um sistema imunologico enfraquecido,100,como construir um sistema imunologico enfraquecido,100,como tratar um sistema imunologico enfraquecido,100
quanti sono i casi di coronavirus em toscana,virus corona infectado na italia,80,onde esta o coronavirus na italia ,80,quantos casos de coronavirus existem na italia,80
como pode o efeito corona ser reduzido,como o coronavirus pode ser tratado,80,o coronavirus pode ser tratado,70,o virus corona pode ser curado,0
escola covid 19 ac,covid 19 ac costco,30,locais covid 19 ac,30,o que e covid 19 ac,30
noticias sobre coronavirus florida,coronavirus na florida ultimas noticias,100,noticias sobre virus corona noticias sobre a china,0,noticias sobre coronavirus havai,0
como posso saber se tenho um sistema imunologico forte,como posso saber se tenho um sistema imunologico enfraquecido,0,como posso saber se tenho um sistema imunologico fraco,0,como saber se tenho forte sistema imunologico,100
noticias sobre coronavirus bloqueio dos eua,noticias sobre coronavirus bloqueio em londres,0,noticias sobre coronavirus eua,30,noticias sobre coronavirus bloqueio do estado de washington,10
alfandega de coronavirus,primeiro diagnostico de coronavirus na alfandega do leste de londres,10,coronavirus primeiro diagnostico de coronavirus encontrado na alfandega leste de londres,10,primeiro diagnostico de coronavirus encontrado na alfandega do leste de londres,10
pode corona acabar com o mundo,poderia o coronavirus acabar com o mundo,100,o coronavirus vai acabar com o mundo,100,o mundo vai acabar por causa do covid-19?,100
atualizacao em coronavirus no reino unido,atualizacao do coronavirus no reino unido,100,coronavirus no reino unido atualizacao hoje,100,ultima atualizacao do coronavirus no reino unido,100
voce pode construir um sistema imunologico mais forte,como construir um sistema imunologico mais forte naturalmente,80,como voce pode construir um sistema imunologico,70,como voce constroi um sistema imunologico mais forte,90
o coronavirus esta diminuindo as declaracoes de impostos,o coronavirus esta afetando as declaracoes fiscais,100,o coronavirus esta diminuindo,0,o coronavirus afetara as restituicoes de impostos,100
como ajudar o sistema imunologico fraco,como ajudar o sistema imunologico enfraquecido,100,como detectar sistema imunologico fraco,30,como diagnosticar sistema imunologico fraco,30
