Perguntas,Respostas
Are children at lower risk of COVID-19 than adults ?,"So far, data suggests that children under the age of 18 years represent about 8.5% of reported cases, with relatively few deaths compared to other age groups and usually mild disease. However, cases of critical illness have been reported. As with adults, pre-existing medical conditions have been suggested as a risk factor for severe disease and intensive care admission in children.Further studies are underway to assess the risk of infection in children and to better understand transmission in this age group.So far, data suggests that children under the age of 18 years represent about 8.5% of reported cases, with relatively few deaths compared to other age groups and usually mild disease. However, cases of critical illness have been reported. As with adults, pre-existing medical conditions have been suggested as a risk factor for severe disease and intensive care admission in children.Further studies are underway to assess the risk of infection in children and to better understand transmission in this age group."
What is the role of children in transmission ?,"The role of children in transmission is not yet fully understood. To date, few outbreaks involving children or schools have been reported. However, the small number of outbreaks reported among teaching or associated staff to date suggests that spread    of COVID-19 within educational settings may be limited.As children generally have milder illness and fewer symptoms, cases may sometimes go unnoticed. Importantly, early data from studies suggest that infection rates among teenagers may be higher than in younger children.Considering that many countries are starting to slowly lift restrictions on activities, the longer-term effects of keeping schools open on community transmission are yet to be evaluated. Some modelling studies suggest that school re-opening might have    a small effect on wider transmission in the community, but this is not well understood. Further studies are underway on the role of children in transmission in and outside of educational settings. WHO is collaborating with scientists around the world    to develop protocols that countries can use to study COVID-19 transmission in educational institutions. Click here to access this information.The role of children in transmission is not yet fully understood. To date, few outbreaks involving children or schools have been reported. However, the small number of outbreaks reported among teaching or associated staff to date suggests that spread    of COVID-19 within educational settings may be limited.As children generally have milder illness and fewer symptoms, cases may sometimes go unnoticed. Importantly, early data from studies suggest that infection rates among teenagers may be higher than in younger children.Considering that many countries are starting to slowly lift restrictions on activities, the longer-term effects of keeping schools open on community transmission are yet to be evaluated. Some modelling studies suggest that school re-opening might have    a small effect on wider transmission in the community, but this is not well understood. Further studies are underway on the role of children in transmission in and outside of educational settings. WHO is collaborating with scientists around the world    to develop protocols that countries can use to study COVID-19 transmission in educational institutions. Click here to access this information.Click here to access this information"
"Should children with underlying health conditions ( asthma , diabetes , obesity ) return to school ?","Whether a child should go to school depends on their health condition, the current transmission of COVID-19 within their community, and the protective measures the school and community have in place to reduce the risk of COVID-19 transmission. While current evidence suggests that the risk of severe disease for children is lower overall than for adults, special precautions can be taken to minimize the risk of infection among children, and the benefits of returning to school should also be considered.Current evidence suggests that people with underlying conditions such as chronic respiratory illness including asthma (moderate-to-severe), obesity, diabetes or cancer, are at higher risk of developing severe disease and death than people without other health conditions. This also appears to be the case for children, but more information is still needed.Whether a child should go to school depends on their health condition, the current transmission of COVID-19 within their community, and the protective measures the school and community have in place to reduce the risk of COVID-19 transmission. While current evidence suggests that the risk of severe disease for children is lower overall than for adults, special precautions can be taken to minimize the risk of infection among children, and the benefits of returning to school should also be considered.Current evidence suggests that people with underlying conditions such as chronic respiratory illness including asthma (moderate-to-severe), obesity, diabetes or cancer, are at higher risk of developing severe disease and death than people without other health conditions. This also appears to be the case for children, but more information is still needed."
Should teachers and other staff with underlying health conditions return to school ?,"Adults 60 years and older and people with underlying health conditions are at higher risk for severe disease and death. The decision to return to a teaching environment depends on the individual and should include consideration of local disease trends, as well as the measures being put in place in schools to prevent further spread.Adults 60 years and older and people with underlying health conditions are at higher risk for severe disease and death. The decision to return to a teaching environment depends on the individual and should include consideration of local disease trends, as well as the measures being put in place in schools to prevent further spread."
What is the incubation period for children ?,"The incubation period for children is the same as in adults. The time between exposure to COVID-19 and when symptoms start is commonly around 5 to 6 days, and ranges from 1 to 14 days.The incubation period for children is the same as in adults. The time between exposure to COVID-19 and when symptoms start is commonly around 5 to 6 days, and ranges from 1 to 14 days."
What should be considered when deciding whether to re-open schools or keep them open ?,"Deciding to close, partially close or reopen schools should be guided by a risk-based approach, to maximize the educational, well-being and health benefit for students, teachers, staff, and the wider community, and help prevent a new outbreak of COVID-19 in the community.Several elements should be assessed in deciding to re-open schools or keep them open:The epidemiology of COVID-19 at the local level: This may vary from one place to another within a countryBenefits and risks: what are the likely benefits and risks to children and staff of open schools? Including consideration of:Transmission intensity in the area where the school operates: No cases, sporadic transmission; clusters transmission or community transmissionOverall impact of school closures on education, general health and wellbeing; and on vulnerable and marginalized populations (e.g. girls, displaced or disabled)Effectiveness of remote learning strategiesDetection and response: Are the local health authorities able to act quickly?The capacity of schools/educational institutions to operate safelyCollaboration and coordination: Is the school collaborating with local public health authorities?The range of other public health measures being implemented outside schoolDeciding to close, partially close or reopen schools should be guided by a risk-based approach, to maximize the educational, well-being and health benefit for students, teachers, staff, and the wider community, and help prevent a new outbreak of COVID-19 in the community.Several elements should be assessed in deciding to re-open schools or keep them open:The epidemiology of COVID-19 at the local level: This may vary from one place to another within a countryBenefits and risks: what are the likely benefits and risks to children and staff of open schools? Including consideration of:Transmission intensity in the area where the school operates: No cases, sporadic transmission; clusters transmission or community transmissionOverall impact of school closures on education, general health and wellbeing; and on vulnerable and marginalized populations (e.g. girls, displaced or disabled)Effectiveness of remote learning strategiesDetection and response: Are the local health authorities able to act quickly?The capacity of schools/educational institutions to operate safelyCollaboration and coordination: Is the school collaborating with local public health authorities?The range of other public health measures being implemented outside schoolThe epidemiology of COVID-19 at the local level: This may vary from one place to another within a countryBenefits and risks: what are the likely benefits and risks to children and staff of open schools? Including consideration of:Transmission intensity in the area where the school operates: No cases, sporadic transmission; clusters transmission or community transmissionOverall impact of school closures on education, general health and wellbeing; and on vulnerable and marginalized populations (e.g. girls, displaced or disabled)Effectiveness of remote learning strategiesTransmission intensity in the area where the school operates: No cases, sporadic transmission; clusters transmission or community transmissionOverall impact of school closures on education, general health and wellbeing; and on vulnerable and marginalized populations (e.g. girls, displaced or disabled)Effectiveness of remote learning strategiesTransmission intensity in the area where the school operates: No cases, sporadic transmission; clusters transmission or community transmissionOverall impact of school closures on education, general health and wellbeing; and on vulnerable and marginalized populations (e.g. girls, displaced or disabled)Effectiveness of remote learning strategiesDetection and response: Are the local health authorities able to act quickly?The capacity of schools/educational institutions to operate safelyCollaboration and coordination: Is the school collaborating with local public health authorities?The range of other public health measures being implemented outside school"
What benefits would school re-opening provide ?,"School closures have clear negative impacts on child health, education and development, family income and the overall economy.The decision to reopen schools should include consideration of the following benefits:Allowing students to complete their studies and continue to the next levelEssential services, access to nutrition, child welfare, such as preventing violence against childrenSocial and psychological well-beingAccess to reliable information on how to keep themselves and others safeReducing the risk of non-return to schoolBenefit to society, such as allowing parents to workSchool closures have clear negative impacts on child health, education and development, family income and the overall economy.The decision to reopen schools should include consideration of the following benefits:Allowing students to complete their studies and continue to the next levelEssential services, access to nutrition, child welfare, such as preventing violence against childrenSocial and psychological well-beingAccess to reliable information on how to keep themselves and others safeReducing the risk of non-return to schoolBenefit to society, such as allowing parents to workAllowing students to complete their studies and continue to the next levelEssential services, access to nutrition, child welfare, such as preventing violence against childrenSocial and psychological well-beingAccess to reliable information on how to keep themselves and others safeReducing the risk of non-return to schoolBenefit to society, such as allowing parents to work"
